{
  "schemaVersion": 1,
  "id": "circuit_stage_1",
  "type": "reach_top",
  "characterId": "prototype_climber",
  "wallId": "wall_circuit_01",
  "instruction": "Circuito, escenario 1 de 5 - LA PLACA (5.5 m): arranque (0°)-> placa (18°). Lleva ambas manos a la presa cima. Un pie en presa de mano carga x2.",
  "timeLimitSeconds": 300,
  "start": {
    "stance": "standing",
    "requiredAnchors": [
      {
        "limb": "hand_l",
        "holdId": "start_l"
      },
      {
        "limb": "hand_r",
        "holdId": "start_r"
      }
    ],
    "autoStart": false,
    "impulse": [
      0,
      0,
      0
    ]
  },
  "rules": {
    "allowFreeTarget": false,
    "allowHandsOnFootHolds": false,
    "allowFeetOnHandHolds": true,
    "minSupportCount": 2,
    "fallPlaneY": -0.25,
    "fallDropDistance": 0.35,
    "fallGraceSeconds": 0.35
  },
  "completion": {
    "holdIds": [
      "top"
    ],
    "requiredLimbs": [
      "hand_l",
      "hand_r"
    ],
    "stableDurationSeconds": 0.5,
    "stabilityThreshold": 0.65
  },
  "instructionEn": "Vertical route: climb with real physics and get both hands to the top hold, holding the posture."
}
