{
  "schemaVersion": 1,
  "id": "challenge_reach_top",
  "type": "reach_top",
  "characterId": "prototype_climber",
  "wallId": "wall_basic_01",
  "instruction": "Cuelgas de las presas de inicio: apoya los pies y sube hasta llevar ambas manos a la presa superior.",
  "timeLimitSeconds": 150,
  "start": {
    "stance": "hanging",
    "requiredAnchors": [
      {
        "limb": "hand_l",
        "holdId": "start_l"
      },
      {
        "limb": "hand_r",
        "holdId": "start_r"
      }
    ],
    "autoStart": false,
    "impulse": [
      0,
      0,
      0
    ]
  },
  "rules": {
    "allowFreeTarget": false,
    "allowHandsOnFootHolds": false,
    "allowFeetOnHandHolds": true,
    "minSupportCount": 2,
    "fallPlaneY": -0.25,
    "fallDropDistance": 0.35,
    "fallGraceSeconds": 0.35
  },
  "completion": {
    "holdIds": [
      "top"
    ],
    "requiredLimbs": [
      "hand_l",
      "hand_r"
    ],
    "stableDurationSeconds": 0.5,
    "stabilityThreshold": 0.65
  },
  "instructionEn": "You hang from the starting holds: set your feet and climb until both hands reach the top hold."
}
