{
  "schemaVersion": 1,
  "id": "challenge_speed_run",
  "type": "reach_top",
  "characterId": "prototype_climber",
  "wallId": "wall_basic_01",
  "instruction": "Contrarreloj: la misma cima con solo 60 segundos. Encadena movimientos rapidos para el combo de FLUJO y no dejes que la fatiga te traicione.",
  "timeLimitSeconds": 60,
  "start": {
    "stance": "hanging",
    "requiredAnchors": [
      {
        "limb": "hand_l",
        "holdId": "start_l"
      },
      {
        "limb": "hand_r",
        "holdId": "start_r"
      }
    ],
    "autoStart": false,
    "impulse": [0, 0, 0]
  },
  "rules": {
    "allowFreeTarget": false,
    "allowHandsOnFootHolds": false,
    "allowFeetOnHandHolds": true,
    "minSupportCount": 2,
    "fallPlaneY": -0.25,
    "fallDropDistance": 0.35,
    "fallGraceSeconds": 0.3
  },
  "completion": {
    "holdIds": ["top"],
    "requiredLimbs": ["hand_l", "hand_r"],
    "stableDurationSeconds": 0.35,
    "stabilityThreshold": 0.6
  }
}
